{
  "schemaVersion": 1,
  "project": "dwarka",
  "chapter": "chapter-1",
  "generatedAt": "2026-09-03T19:19:29.949Z",
  "provider": {
    "id": "sarvam",
    "ttsModel": "bulbul:v3",
    "sttModel": "saaras:v3",
    "syntheticVoice": true,
    "developmentFallback": false
  },
  "locales": [
    {
      "code": "en",
      "bcp47": "en-IN",
      "label": "English"
    },
    {
      "code": "hi",
      "bcp47": "hi-IN",
      "label": "Hindi"
    },
    {
      "code": "ta",
      "bcp47": "ta-IN",
      "label": "Tamil"
    },
    {
      "code": "kn",
      "bcp47": "kn-IN",
      "label": "Kannada"
    },
    {
      "code": "te",
      "bcp47": "te-IN",
      "label": "Telugu"
    }
  ],
  "personas": [
    {
      "role": "narrator",
      "personaId": "dwarka.narrator.v1",
      "label": "Narrator",
      "description": "Restrained adult narrator",
      "providerVoice": "manan"
    },
    {
      "role": "vrishaketu",
      "personaId": "dwarka.vrishaketu.v1",
      "label": "Vrishaketu",
      "description": "Young adult male Vrishaketu",
      "providerVoice": "aditya"
    },
    {
      "role": "kunti",
      "personaId": "dwarka.kunti.v1",
      "label": "Kunti",
      "description": "Adult female Kunti",
      "providerVoice": "pooja"
    },
    {
      "role": "chitra",
      "personaId": "dwarka.chitra.v1",
      "label": "Chitra",
      "description": "Soft female Chitra voice",
      "providerVoice": "kavitha"
    },
    {
      "role": "raider-one",
      "personaId": "dwarka.raider-one.v1",
      "label": "Raider one",
      "description": "First adult male raider",
      "providerVoice": "amit"
    },
    {
      "role": "raider-two",
      "personaId": "dwarka.raider-two.v1",
      "label": "Raider two",
      "description": "Second adult male raider",
      "providerVoice": "rohan"
    }
  ],
  "lineCount": 13,
  "entryCount": 65,
  "assetCount": 130,
  "entries": [
    {
      "sourceLineId": "ch0-panel-01-battlefield",
      "scope": "chapter-0",
      "sequence": 1,
      "locale": "en",
      "bcp47": "en-IN",
      "role": "narrator",
      "personaId": "dwarka.narrator.v1",
      "providerVoice": "manan",
      "text": "Karna stood for his last day beneath a sun dimmed by dust. Around him, the field had forgotten the difference between victory and grief.",
      "cacheKey": "d0a5674aaedbd2fb",
      "generatedAt": "2026-09-01T21:01:28.830Z",
      "status": "validated",
      "provider": "sarvam",
      "ttsModel": "bulbul:v3",
      "syntheticVoice": true,
      "validation": {
        "method": "sarvam-stt",
        "sttModel": "saaras:v3",
        "similarity": 0.9545,
        "transcriptSha256": "f826c23d41d8693e3e1bbe21116bc4ffd0595d61dddc803562f4d4452505071d",
        "detectedLanguage": "en-IN"
      },
      "assets": [
        {
          "codec": "mp3",
          "mimeType": "audio/mpeg",
          "runtimePath": "/audio/chapter-1/voices/en/ch0-panel-01-battlefield-d0a5674aaedbd2fb.mp3",
          "sha256": "5ed28e3cf5f2dc7d52da9a43290faf1def27c8b7341220f72dcd9c4c955df1eb",
          "bytes": 147456,
          "validation": {
            "method": "sarvam-stt",
            "sttModel": "saaras:v3",
            "similarity": 0.9545,
            "transcriptSha256": "ddfa63e535269dacc7c9edbfeac0de0e50bbf1ee34b9ddbf25b93234403ae6a0",
            "detectedLanguage": "en-IN"
          }
        },
        {
          "codec": "ogg",
          "mimeType": "audio/ogg",
          "runtimePath": "/audio/chapter-1/voices/en/ch0-panel-01-battlefield-d0a5674aaedbd2fb.ogg",
          "sha256": "33c45b87346c03e9fea6fe9c8830b12f10159866bea181567f3faa3f44517279",
          "bytes": 61065,
          "validation": {
            "method": "sarvam-stt",
            "sttModel": "saaras:v3",
            "similarity": 0.9545,
            "transcriptSha256": "ddfa63e535269dacc7c9edbfeac0de0e50bbf1ee34b9ddbf25b93234403ae6a0",
            "detectedLanguage": "en-IN"
          }
        }
      ]
    },
    {
      "sourceLineId": "ch0-panel-01-battlefield",
      "scope": "chapter-0",
      "sequence": 1,
      "locale": "hi",
      "bcp47": "hi-IN",
      "role": "narrator",
      "personaId": "dwarka.narrator.v1",
      "providerVoice": "manan",
      "text": "कर्ण धूल से धुँधले हुए सूर्य के नीचे अपने अंतिम दिन के लिए खड़े थे। उनके चारों ओर रणभूमि विजय और शोक का अंतर भूल चुकी थी।",
      "cacheKey": "535b55e7b4a4f2bf",
      "generatedAt": "2026-09-01T21:01:29.351Z",
      "status": "validated",
      "provider": "sarvam",
      "ttsModel": "bulbul:v3",
      "syntheticVoice": true,
      "validation": {
        "method": "sarvam-stt",
        "sttModel": "saaras:v3",
        "similarity": 0.9783,
        "transcriptSha256": "bb960a9bc455543252bf721fb6e93a9df2e52d772e38cf7f712f98151f8d8ffb",
        "detectedLanguage": "hi-IN"
      },
      "assets": [
        {
          "codec": "mp3",
          "mimeType": "audio/mpeg",
          "runtimePath": "/audio/chapter-1/voices/hi/ch0-panel-01-battlefield-535b55e7b4a4f2bf.mp3",
          "sha256": "8e54534b5db098bed456cdfc1ff4755e32574364307f8fec9fa9c5f45a346e3c",
          "bytes": 185856,
          "validation": {
            "method": "sarvam-stt",
            "sttModel": "saaras:v3",
            "similarity": 0.9783,
            "transcriptSha256": "5ac13624eb3e8ae5c8712f7d2578cb9ae4ba100e935f2dd8454c01d89a1a836e",
            "detectedLanguage": "hi-IN"
          }
        },
        {
          "codec": "ogg",
          "mimeType": "audio/ogg",
          "runtimePath": "/audio/chapter-1/voices/hi/ch0-panel-01-battlefield-535b55e7b4a4f2bf.ogg",
          "sha256": "a95e99826fd5e7e8152f0ba658cec75762b8254496bbdc9d3a6b6901e19a9dd2",
          "bytes": 72896,
          "validation": {
            "method": "sarvam-stt",
            "sttModel": "saaras:v3",
            "similarity": 0.9783,
            "transcriptSha256": "5ac13624eb3e8ae5c8712f7d2578cb9ae4ba100e935f2dd8454c01d89a1a836e",
            "detectedLanguage": "hi-IN"
          }
        }
      ]
    },
    {
      "sourceLineId": "ch0-panel-01-battlefield",
      "scope": "chapter-0",
      "sequence": 1,
      "locale": "ta",
      "bcp47": "ta-IN",
      "role": "narrator",
      "personaId": "dwarka.narrator.v1",
      "providerVoice": "manan",
      "text": "தூசியால் மங்கிய சூரியனின் கீழ் கர்ணன் தனது இறுதி நாளை எதிர்கொண்டு நின்றான். அவனைச் சுற்றிய போர்க்களம் வெற்றிக்கும் துயரத்துக்கும் உள்ள வேறுபாட்டை மறந்திருந்தது.",
      "cacheKey": "1061fb3f343cf6b4",
      "generatedAt": "2026-09-01T21:01:29.878Z",
      "status": "validated",
      "provider": "sarvam",
      "ttsModel": "bulbul:v3",
      "syntheticVoice": true,
      "validation": {
        "method": "sarvam-stt",
        "sttModel": "saaras:v3",
        "similarity": 0.9819,
        "transcriptSha256": "4f13bb6ec7e983127dbfed57f9c08a5404360ca7bb295df961d028fac43594e0",
        "detectedLanguage": "ta-IN"
      },
      "assets": [
        {
          "codec": "mp3",
          "mimeType": "audio/mpeg",
          "runtimePath": "/audio/chapter-1/voices/ta/ch0-panel-01-battlefield-1061fb3f343cf6b4.mp3",
          "sha256": "52ea8d215d999e5a3a6b304f16458a281b40a34ade5e626633331e0e5b9e9f9a",
          "bytes": 191616,
          "validation": {
            "method": "sarvam-stt",
            "sttModel": "saaras:v3",
            "similarity": 0.9819,
            "transcriptSha256": "d9983d56ccac9cfe7d960f8164f40b6d9a32d7216d5d019c543450d7d1f10ed5",
            "detectedLanguage": "ta-IN"
          }
        },
        {
          "codec": "ogg",
          "mimeType": "audio/ogg",
          "runtimePath": "/audio/chapter-1/voices/ta/ch0-panel-01-battlefield-1061fb3f343cf6b4.ogg",
          "sha256": "c494d4d252debd4a50cb79415c585c9c25efb430919e4ca4783a84302e2520d3",
          "bytes": 77218,
          "validation": {
            "method": "sarvam-stt",
            "sttModel": "saaras:v3",
            "similarity": 0.9819,
            "transcriptSha256": "d9983d56ccac9cfe7d960f8164f40b6d9a32d7216d5d019c543450d7d1f10ed5",
            "detectedLanguage": "ta-IN"
          }
        }
      ]
    },
    {
      "sourceLineId": "ch0-panel-01-battlefield",
      "scope": "chapter-0",
      "sequence": 1,
      "locale": "kn",
      "bcp47": "kn-IN",
      "role": "narrator",
      "personaId": "dwarka.narrator.v1",
      "providerVoice": "manan",
      "text": "ಧೂಳಿನಿಂದ ಮಂಕಾದ ಸೂರ್ಯನ ಕೆಳಗೆ ಕರ್ಣನು ತನ್ನ ಕೊನೆಯ ದಿನವನ್ನು ಎದುರಿಸಿ ನಿಂತನು. ಅವನ ಸುತ್ತಲಿನ ರಣಭೂಮಿ ಜಯ ಮತ್ತು ದುಃಖದ ನಡುವಿನ ವ್ಯತ್ಯಾಸವನ್ನೇ ಮರೆತಿತ್ತು.",
      "cacheKey": "b90bc39611bd8d92",
      "generatedAt": "2026-09-01T21:01:30.399Z",
      "status": "validated",
      "provider": "sarvam",
      "ttsModel": "bulbul:v3",
      "syntheticVoice": true,
      "validation": {
        "method": "sarvam-stt",
        "sttModel": "saaras:v3",
        "similarity": 1,
        "transcriptSha256": "89e4c214d7b005cd65f0fab5020d2cbf81ceedd3980d03b23f4a24fa10b2fa4d",
        "detectedLanguage": "kn-IN"
      },
      "assets": [
        {
          "codec": "mp3",
          "mimeType": "audio/mpeg",
          "runtimePath": "/audio/chapter-1/voices/kn/ch0-panel-01-battlefield-b90bc39611bd8d92.mp3",
          "sha256": "0bfa69536d034f2d4525051bb97290f65cbc77a4e78d407c8bec82d8f7aee5fe",
          "bytes": 221568,
          "validation": {
            "method": "sarvam-stt",
            "sttModel": "saaras:v3",
            "similarity": 1,
            "transcriptSha256": "5ecb72c0e6e26bcd3c722677525a5b56dcbd4302a77979b4a6dc43ea3cd2d200",
            "detectedLanguage": "kn-IN"
          }
        },
        {
          "codec": "ogg",
          "mimeType": "audio/ogg",
          "runtimePath": "/audio/chapter-1/voices/kn/ch0-panel-01-battlefield-b90bc39611bd8d92.ogg",
          "sha256": "c3754f34ee0ebb3dc17f996e790d2af4bfb6ddee312a9cce6f6c082d00cf5684",
          "bytes": 84530,
          "validation": {
            "method": "sarvam-stt",
            "sttModel": "saaras:v3",
            "similarity": 1,